{
  "shadow_signal_summary_id": "SSS-0003",
  "schema_version": "v2",
  "generated_at": "2026-04-22T08:00:00Z",
  "corpus_window": {
    "first_overlay_shadow_log_id": "OSH-0001",
    "last_overlay_shadow_log_id": "OSH-0010",
    "first_observed_at": "2026-04-19T17:00:00Z",
    "last_observed_at": "2026-04-22T08:00:00Z",
    "total_source_observation_count": 10
  },
  "derivation_method": "shadow_signal_summary_option_a_floor_10_v1",
  "segmentation_axes": [
    "advisory_source",
    "source_bucket_mapping_id",
    "source_pre_gate_advisory_snapshot_id"
  ],
  "derivation_inputs": {
    "source_relation": "overlay_shadow_logs",
    "source_artifact_family": "overlay_shadow_logs",
    "fixture_identity_rule": "committed_overlay_input_pair_v1",
    "rate_denominator_rule": "match_plus_mismatch"
  },
  "segments": [
    {
      "advisory_source": "BMAP",
      "source_bucket_mapping_id": "BMAP-0001",
      "source_pre_gate_advisory_snapshot_id": null,
      "match_count": 0,
      "mismatch_count": 3,
      "abstention_count": 0,
      "observation_count": 3,
      "rate_denominator": 3,
      "agreement_rate": null,
      "disagreement_rate": null,
      "insufficient_evidence": true,
      "signal_outcome": "INSUFFICIENT_EVIDENCE",
      "first_observed_at": "2026-04-19T17:00:00Z",
      "last_observed_at": "2026-04-22T05:00:00Z"
    },
    {
      "advisory_source": "BMAP",
      "source_bucket_mapping_id": "BMAP-0002",
      "source_pre_gate_advisory_snapshot_id": null,
      "match_count": 2,
      "mismatch_count": 0,
      "abstention_count": 0,
      "observation_count": 2,
      "rate_denominator": 2,
      "agreement_rate": null,
      "disagreement_rate": null,
      "insufficient_evidence": true,
      "signal_outcome": "INSUFFICIENT_EVIDENCE",
      "first_observed_at": "2026-04-22T03:00:00Z",
      "last_observed_at": "2026-04-22T07:00:00Z"
    },
    {
      "advisory_source": "PGAS",
      "source_bucket_mapping_id": "BMAP-0001",
      "source_pre_gate_advisory_snapshot_id": "PGAS-0002",
      "match_count": 0,
      "mismatch_count": 3,
      "abstention_count": 0,
      "observation_count": 3,
      "rate_denominator": 3,
      "agreement_rate": null,
      "disagreement_rate": null,
      "insufficient_evidence": true,
      "signal_outcome": "INSUFFICIENT_EVIDENCE",
      "first_observed_at": "2026-04-19T18:00:00Z",
      "last_observed_at": "2026-04-22T06:00:00Z"
    },
    {
      "advisory_source": "PGAS",
      "source_bucket_mapping_id": "BMAP-0002",
      "source_pre_gate_advisory_snapshot_id": "PGAS-0003",
      "match_count": 2,
      "mismatch_count": 0,
      "abstention_count": 0,
      "observation_count": 2,
      "rate_denominator": 2,
      "agreement_rate": null,
      "disagreement_rate": null,
      "insufficient_evidence": true,
      "signal_outcome": "INSUFFICIENT_EVIDENCE",
      "first_observed_at": "2026-04-22T04:00:00Z",
      "last_observed_at": "2026-04-22T08:00:00Z"
    }
  ],
  "deterministic": true,
  "advisory_only": true,
  "notes": "WP-8d second committed SSS v2 instance. This advisory-lineage segment form is encoded by advisory_source, source_bucket_mapping_id, and source_pre_gate_advisory_snapshot_id; it is descriptive, deterministic, advisory-only, and has no consumer, policy, runtime, override, OMS, risk, or execution authority."
}
